<config xmlns:xsi="http://www.w3.org/2001/XMLSchema-instance"
        xsi:noNamespaceSchemaLocation="cron_modify.xsd">
    <group name="default">
        <remove_job>currency_rates_update</remove_job>
        <remove_job>backend_clean_cache</remove_job>
        <move_job to_group="index">backend_clean_cache</move_job>
    </group>
    <group name="nosto">
        <remove_job>disable-me3</remove_job>
        <remove_job>disable-me4</remove_job>
    </group>
</config>

